"Region 4(High Valence, Low Intensity)",,"Region 1 (High Valence, High Intensity)",,"Region 3( Low Valence, Low Intensity)",,"Region 2 (Low Valence, High Intensity)",
"You've been under a lot of stress lately, is there any way I can help lighten your workload while you are going through a bit of a rough patch?","SSG, you're a great squad leader, I just need you to focus on work while you are here","SSG, why don't you take the rest of the day off to spend with your family","SSG, if you need somewhere to stay, my door is always open. If you need someone to talk to about your situation, please don't hesitate.","SSG, you need to focus more on what you are doing while you are here at work so the soldiers aren't affected. ",You can't let your emotions out on your fellow soldiers. They won't respect you the same if you are always treating them poorly. ,"If I catch you acting like this again, there will be serious consequences. This is not how a squad leader should act.","SSG, your home life stays at home. You need to separate your home and work life. "
SSG Burch I totally understand where you are coming from. I know I would be struggling if I were in your shoes. If you ever need to talk more about some of your frustrations please feel free to drop by,"SSG Burch, I am sorry for your struggles at home, I really am. However, as you know, we cannot allow our home life to influence how we treat our soldiers. I do understand where you are coming from though and would like to help in any way possible.",Lets just forget about today and the event that occurred. Go ahead and take the day off and relax a little. ,"You were spot on for how you treated your soldier, if he keeps screwing up you better stay on his ass until he gets his act together. ",I am sorry to hear that you've been having some struggles in your home life. It is hard to balance everything but you just have to do it.,"The way you handled the situation back there was unprofessional, I understand you've been having some hard times at home but if this happens again I am going to have to give you an official counseling.",I do not care if you have been having problems at home. It is your job to lead your soldiers effectively but I have not seen you doing that!,"It is not my job to worry about your family problems, all I care about is that you are taking care of my soldiers. "
Why don't you take the day off to calm down. Maybe you should try speaking to your wife tonight calmly and try to get to the bottom of your problems.,I understand SSG Burch. Maybe it would be good to get as much of this negativity off your chest as possible. Why don't you stay here and speak with me for a while.,"SSG, you take the rest of the day off. I will address your squad and everything will be taken care of. Take care of yourself and I am sure your work will reflect that.","SSG Burch, you are an excellent squad leader. This behavior does not reflect the amazing work you do. Let me help you and your squad with their duties for today so you can take some extra time to unwind.","I understand you may be having it rough at home right now, but remember that we need to keep our home lives separate from our work behaviors and remain professional at all times.","You cannot take your problems out on our soldiers. Calm down, return to your duties, and do not make this mistake again.",Are you kidding me SSG?! You cannot speak to your soldiers like that. Your behavior is unacceptable. The next time I hear something like this from you we are going to have a problem.,"SSG, you need to man up. Do not let your home problems interfere with your work."
I understand that your home life is stressful. What can I do to help assist you at work to make things better? ,,You have shown quality work and leadership in the past. I know you have command potential in you. Everyone experiences a rough patch,,I need you to stop yelling at the men and calling them retarded. It is unbecoming of you as an NCO and a disgrace to this company. I expect more out of you,,I don't care about your home issues. Don't bring them to work. Take care of it on your own time and not at the expense of my soldiers.,
"Sgt., the Army has a lot of resources that can help with these types of situations and issues. Let's use them accordingly. ","Sgt., verbal abuse is not the way to go. Trust me. Let's find other methods to get the job done.",I can see how some troops need a more direct approach. Keep it up Sgt.,You know more than I do about getting troops to do the right thing. Have at it.,Are you freaking kidding me Sgt.? Shame on you for taking your personal problems out on motivated troops.,How dare you bring your family problems to work. Verbal abuse of any kin will not be tolerated. Is that clear?,"If I hear you talk that way to another solider, I am going to reach deep inside your soul and remove your heart. Dismiss.",Apologize to the solider. Now!
I understand that stress in your life is getting to you. Don't worry about this right now we can work on things later in the week. ,I'm really sorry to hear that things have been a mess lately. You're still doing a great job. ,The situation is understandable and I must say I am very impressed with how you are controlling your group. ,You are one of my best people here. Let me know if there is anything I can help with. ,"I understand that life at home is difficult. And It makes sense why you were yelling at the soldier, just use another method. ","Don't verbally abuse our people, you have so much more talent than that. ",I do not care about what is going on with your family. I only care about properly dealing with our soldiers. ,You think I want excuses? Fix your attitude. 
"SSG Burch, let me ask you, how many leave days do you have accrued? Let me know because I'm suggesting you take a few days to relax, set aside some time to talk to your wife about recent events. This would not only help you, but everyone as well.","SSG Burch, I understand your possible concerns you have may at home. Honestly, I'd be a little upset if you didn't decide to take some time off. Seriously, your emotional wellbeing is important, take the time you need to talk things with your wife.","SSG Burch, I am aware of your performance as squad leader, you've been doing a great job. Let's keep that going! Your motivation and emotional state are very important. Take a few days off, I'll make sure it's approved, I guarantee it.","SSG Burch, you're an exceptional part of the team, and very important much like your peers. I hate to see you in any emotional state that isn't positive, so don't argue with me when I say you will take a few days off, go on, you have earned it and need it","SGT Burch, You shouldn't let your personal problems affect your work performance, it is completely unprofessional. With the way you treat your soldiers, I would not be surprised if they are also unhappy. Get it together will you?","SGT Burch, as much as your personal life is important to you, it should not in any way, affect your work life. Keep the negativity at home, do not bring it here. I need you to perform, not berate your soldiers, making them not perform. Get over it.","SGT Burch, are you serious? Your private life is just that, private. I don't care what kind of issues you've got going on at home. Your behavior is unacceptable and I'm considering counseling you for it. This will not happen again, do you understand me?","SGT Burch, you have lost your mind. You will not talk to your soldiers that way, or I will treat you like how you treat them. Your private life better not influence your actions again, I will have none of it. Get back to work, do the right thing for once."
"SSG Burch, I can't imagine what you have  been going through. If you ever need someone to talk to, I will be here. ","SSG Burch, I am quite glad you have told me what has been going on at home and I am so sorry to hear that. It sucks because you are working so hard and have troubles at home to exacerbate that.","SSG Burch, I am so glad that you care so much about our soldiers even though you are going through such a hard time with your family!","SSG Burch, continue working hard and I am greatly saddened by the news at home! I know things may get tough but keep being tenacious because I do notice!","Wow, SSG Burch, this type of things happens to absolutely everyone. Why are you using this an excuse for bad behavior at work? Have you ever thought that the soldiers might be going through the same thing?","SSG Burch, I am alarmed and disheartened by this news. I am also going through problems at home and I can tell you, that this is as depressing as it gets and it wont get much better.","SSG Burch, I can NOT believe you are acting in such an unprofessional manner, letting things at home get in the way of your soldiers! I am disgusted once again at you.","SSG Burch, who ever knew you could be such an insensitive NCO to my soldiers. They never deserved your self-serving behavior."
"SGT, this PLT needs you. We will find a way to distribute
your responsibilities so you can focus on yourself starting
next week. The Chaplain's office is a great place to start
looking for marital counseling resources. Just do you for a
while.","SGT. I would like you to take the rest of the day off to 
seek some resources on how to address your issues at home. 
Leadership will work with you to ensure you are ok and I 
would like to hear a plan of what you'd like to do before 
the weekend.","SGT. Go home. Relax. Talk to your wife and come back 
tomorrow. Your soldiers need you but not like this. We
will handle it here until you feel back to 100%.","SGT. We can take it from here if you need to take some 
time to relax. Go home for the day and come back when you
feel ok and have a plan on how to continue.","SGT. This is no place to vent your anger. Whatever your 
issues at home are, you can keep them there. Now go back 
to work.","SGT, I don't care about your issues at home. Go back out 
and go back to work. We can talk about this some other
time.",,
"SGT, this PLT needs you. We will find a way to distribute
your responsibilities so you can focus on yourself starting
next week. The Chaplain's office is a great place to start
looking for marital counseling resources. Just do you for a
while.","SGT. I would like you to take the rest of the day off to 
seek some resources on how to address your issues at home. 
Leadership will work with you to ensure you are ok and I 
would like to hear a plan of what you'd like to do before 
the weekend.","SGT. Go home. Relax. Talk to your wife and come back 
tomorrow. Your soldiers need you but not like this. We
will handle it here until you feel back to 100%.","SGT. We can take it from here if you need to take some 
time to relax. Go home for the day and come back when you
feel ok and have a plan on how to continue.","SGT. This is no place to vent your anger. Whatever your 
issues at home are, you can keep them there. Now go back 
to work.","SGT, I don't care about your issues at home. Go back out 
and go back to work. We can talk about this some other
time.","What is wrong with you? That is no way to talk to the 
soldiers. Now, I want you to go back out there and 
apologize to that soldier.","I don't care what your issues are. That's no excuse to 
show that level of incompetence."
I understand you are under a lot of stress at home . Lets talk about what you need and how I can help you deal with this difficult time so you are less stressed out at work. ,I know you are really stressed out today. Go ahead and take the day off so you regroup and be focussed tomorrow. I'll have another squad leader take care of your duties today.,"I know you are stressed out at home, but you have been doing a great job here. Good news, you have been promoted!",I can't have you treating my soldiers the way you are. I'll rotate you out for the next couple months so you have less responsiblities and focus on your family. ,This is unacceptable behavior as an NCO and not in line with our Army leadership standards. I need you to do better.,"I understand you are stressed out, but do you realize that your soldiers might be dealing with the same issues which may also be affecting thier performance at work?",You will be formally counseled for your innapropriate behavior. ,"I don't care if you have personal problems at home, you can't fly off the handle on your soldiers, period. "
"SSG Burch, I’m sorry to hear about the problems with your wife. However, problems are there to be solved and I’m positive you can overcome this.","SSG Burch, you’ve been having a bad time; I can definitely understand your frustration. If you ever need someone to talk to, I’m always available.",SSG Burch don’t ever verbally abuse a soldier like that again OR I will make sure you get the same type of treatment in front of your own soldiers.,You’ve made your fair share of mistakes as we all should. I expected better from you as a staff sergeant. Would you have liked the same treatment as you gave Jones? You should be embarrassed.,"SSG Burch, you’re the worst NCO I’ve ever known. You deserve your rank nor do you deserve to lead soldiers.", You’re weak sauce if a few arguments with your wife has put you under so much stress that you need to go crazy on your soldiers. Perhaps you need to rethink whether you should be in the army.,,
"SSg, souns like you are going though a very trying time right now.  I have some resourses you and your spose could take part in to help remedy the situation and I will work to ensure you have the time to take care of this.","SSg, it sounds like you have a lot on your plate.  Lets work together and find a way that we can get you some time to figure our solutions to the things troubling your and your family.","SSg, you are a great NCO an I have seen you do great things with the platoon.  When things get hard at home I want you to know that there is always someone that you can reach out to whether it be me or the platoon sergeant.  We are always more than happy to help with any situation no matter what its is.","SSg, you are going though some stuff right now and I want you to know that you are not alone.  We can help get you and your wife what you need to correct the things that are bothering you.  Tell me more.","SSg, you should not be talking to soldiers like that.  It is in no way acceptable and I think you need to look within and find new ways to treat people.","Ssg,  you just demeaned that soldier and you could have damage your reputation an cohesion within you squad.  I need you to think very sternly on how you are going to remedy the situation.",This is not the first time that we have heard you lash out at a soldier and if it happens again we will have to take corrective action to find a more permanent solution to the issue.,"This sort of behavior will not be tolerated, SSg.  Your attitude toward your soldiers is unacceptable and you will be reprimanded for the manner in which you have chosen to run that squad and treat your soldiers."
"Calm down, take several breaths. If you need anyone to talk to, you can come to me anytime.",I understand you are going through some tough times right now. There are several programs designed to help soldiers cope with stressful times. Let’s talk about some of the options that might work for you.,You are doing a fine job. I need you to find a better approach when addressing the soldiers.,Take a few days off and figure everything out at home. Do not worry about work we will take care of everything here so you can focus on personal matters.,"I do not care what is going on at home, that is no excuse for acting that way.",Leave you personal matters at home; do not bring them into work.,That is no excuse for treating him that way. I am writing you up.,The failure of your soldiers is a direct representation of their leadership.
"we must make sure our home lives do not flow over into our professional lives.  Lets see if we can get you and your wife some counseling or help, maybe that will help with some of your stress.","Soldiers do dumb things at times, but we must identify error and correct.  You’ve done great work so far lets find a positive way for you to distress besides drinking and get you and your soldiers back in the fight.","When you don’t have stress from home you do a great job training these soldiers.  How about we find a way to relax without the booz, and keep positive moral.","Take a few days and go fish, or whatever you like to do besides drink, figure things out with your wife so I can get you back here doing a great job.","regardless of soldiers action belittlement is not acceptable, you have conducted yourself in an unprofessional manner.",This has been your worst display of unprofessionalism to date.  Letting your home life carry stress to work can get soldiers killed.,If this continues you will be given formal reprimand up-to and including reduction of rate and pay,"you will seek guidance for your possible drinking problem, and marriage therapy."
" SSG Burch I know you are under a lot of stress at home. You are an asset to your SQD and I want you to handle the stress you have at home so that you can return to your squad as the relaxed squa leader that you normally are. Please take a week off and try to reconcile issues you experience with your wife and family and don’t worry about work here, we will assign someone to watch after your SQD in your absence.",SSG Burch I am sorry to hear that you are going through a difficult time with your wife. Please know that you are our family too and we do not like to see you this way. Take some time off this week and upon your return we will allow you to leave early the following week to maximize time with your wife and family. Would you like to talk with anyone concerning your current stresses., SSG Burch you are a great SQD leader and you will get through this tough time. You always to a great job.,SSG Burch you do an amazing job with the members of your SQD. Take some time off to spend with your wife this week and if you need to utilize any of the army resources for yours and your families benefits please let me know. You are a member of our family and we want the best for you.,SSG Burch I understand you are going through a lot with the squads mistakes and your personal issues at home but I will not allow you to speak to individuals like you have just done,SSG Burch although I empathize with your circumstances you are not to ever blatantly disrespect a member of our team like that again.,,
"I can empathize with your issue. I cannot give you advice but if you need to vent some of this frustration, my door is open",I understand that soldier are going to screw up. You remember when you first started. Communicating with your wife needs to be your focus.,Would approving leave help you get away from work for a while? Maybe destress with the wife.,My door is always open for you to come vent when the troops do dumb stuff,You cannot be venting at troops for your personal problems. You need to find a better way to work with them. Stop drinking should be your first step.,"This is the army, and those troops need to be trained. Swearing at them will get us nowhere. You need to work harder to control yourself",I do not care about your personal problems. They do not belong here. If you keep swearing at troops you will be in trouble and promotions will not come your way.,"If you talk that way your wife the way you talk to troops, I can see why your wife treats you like that. You should get a negative counseling for how you treat your wife."
"SSG Burch, family issues are family issues. Come talk to me about it, and please try not to take it out on your subordinates.","SSg, souns like you are going though a very trying time right now.  I have some resourses you and your spose could take part in to help remedy the situation and I will work to ensure you have the time to take care of this.","Its good to let out some stress, but try not to do it on your subordinates. You’ll be fine, lets make a time and talk about it later when everything is cooled off.","SSg, you are a great NCO an I have seen you do great things with the platoon.  When things get hard at home I want you to know that there is always someone that you can reach out to whether it be me or the platoon sergeant.  We are always more than happy to help with any situation no matter what its is.","Don’t scream at your subordinates, they probably have similar life issues back at home too.","SSg, you should not be talking to soldiers like that.  It is in no way acceptable and I think you need to look within and find new ways to treat people.",Why did you yell at him like that. You can’t vent off your frustrations at  your subordinates. Work on yourself first.,This is not the first time that we have heard you lash out at a soldier and if it happens again we will have to take corrective action to find a more permanent solution to the issue.
"I appreciate you taking the time to speak with me about this matter, SSG Burch.  I believe this is an easy fix.  Please take the rest of the day off and go spend time with your wife and kids, especially your wife.  ",Thank you for being up front with me on this personal matter.  Take the rest of the week off to spend time with your wife and work on your matters together.  Family is everything and I would not want you to lose yours.,"Please take as much time as you need to assess this matter with your family and yourself.  If you and your wife need to see someone professionally, please let me know and we can make arrangements.  Let me know if there is anything else I can do.","We are also your family here and we want what is best for you.  If you ever need someone to speak with, my door is always open to you. ","This is not the right way to handle this situation, in front of the squad.  For next time, please always speak with the candidate in private instead of berating him in front of his peers.","SSG, while I understand your situation, please refrain from taking it out on soldiers who have nothing to do with your personal life.","SSG, if I ever see you doing this again, you will be relieved from your position.","SSG, this is a major concern and I will deal with this in a swift manner that may not be likeable to you."
"I understand, sergeant. Here are some resources that may be able to help you.","I get it man, but we need to bottle that up while we are here for our soldiers.","I understand, how about we hold a class to show them how to do it right.","I'm sorry to hear that, but when you are here, you need to support your soldiers. They are relying on you to set the example.","Ok, but you still need to leave it at home.","Alright, but yelling at your soldiers doesn't help the situation.",You need to calm down and let it go.,It doesn't matter. That is not how you talk to your subordinates.
"I understand, you've been working too hard. You need a couple of days to cool down and spend time with your family.","Okay, we can help you with your family. It's going to be alright, no need to get frustrated and take it out on your men.","Alright I heard enough, why don't you take leave and spend sometime with your wife.  It should help improve your relationship problems. ","Okay Sgt. why don't leave early today and spend some time with your wife. It should help relieve stress, and improve your relationship with her.",I understand your frustration Sgt. but that is no good to take it out on your soldiers. You are a leader and need to check your emotions. ,Taking it out on your squad isn't going to make your problems go away. It isn't their fault that you are going through a tough time.,So that's why you're verbally abusing a soldier? That is lousy logic and leadership Sgt. Burch!,"I don't care about your personal problems! You are a soldier and a leader, and need to act more of a professional around your squad."
SSG Burch I can see that you are experiencing some difficulties within your squad. Let me take care of this issue and I would like for you to take the rest of the afternoon off.,SSG Burch you are doing a very good job ensuring that the weapons are clean. This is very a very important task and I appreciate you showing so much emphasis towards having a clean weapon.,SSG Burch allow me to discipline the solider for not maintaining his equipment. ,"SSG Burch I see that you are working hard and dedicated to your soldiers success, thank you for your loyalty to this unit.","SSG Burch is there any way that you could change your behavior, you are being a poor leader right now.",Treating your subordinates with disrespect shows that you cannot handle these situations well. ,You need to change your behavior and treat your soldiers better or I am going to recommend that you are disciplined for a lack of respect.,"SSG Burch, why are you allowing your stress from home to flow into the workplace, that is very unprofessional."
It sounds like your having a tough time dealing with this. Ill be there to help anyway I can.,"I can definitely relate to this, it will get better.","I completely agree, these kind of issues suck to deal with. Tell me more about some of the arguments.",How could someone complain about all this when you provide so much of it. ,I still don't think you should talk to the soldiers like that but I understand how you are having a rough time at home. ,I know how tough this can be but you need to stay professional while here at work.,Those soldiers need to be taught like that to make sure they understand. I agree also that it is a huge amount of stress to be burdened like that. ,I don't understand how your family could be mad about that. I dont blame you for getting after the soldiers like that at all.
