"Region 4(High Valence, Low Intensity)",,"Region 1 (High Valence, High Intensity)",,"Region 3( Low Valence, Low Intensity)",,"Region 2 (Low Valence, High Intensity)",
"I understand the challenges of marriage and being in the military. Have you tried any of the Army resources available? Maybe marriage counseling or marriage retreat? If not, here is some information I have available for you.",,Understand completely (possibly share personal story regarding marriage) how about we get a few other sqd leaders together after duty hours and discuss how we can improve weapons maintenance issues  ,What methods have you already used to ensure weapons are being well maintained? Let's get the sqd leaders over to my office to discuss the problem.,Have you considered a divorce? Being in a negative environment is obviously affecting your performance and with the stress from here it does not look too good on you. ,,I don't care what is going on in your relationship. Home and work are two separate things. I do not want to hear that as an excuse again.,Regardless of what is going on in your personal life you do not speak to our soldiers like that. If you are having marital problems there are plenty of resources available to you and if you do not use them then that is your problem and not this platoon's.
"SSG Burch, I understand that you are under a lot of stress and that sometimes people say things they do not mean. Next time try to take a breathe and remember you are on the job, not at home.","SSG Burch, I know it is hard to keep home and work separated, but try and relax and remember that your team looks up to you for guidance.","SSG Burch just talk calmly to your subordinates, you are a valuable member of the platoon and your squad looks up to you.","SSG Burch, I see that stress is getting the best of you. How about you take a pass and relax this weekend.","SSG Burch, if you want to remain a leader in this platoon, you need to rethink how you talk to your subordinates.

","SSG Burch, your actions are not that of a squad leaders, you need to fix yourself before I fix you.","SSG Burch, the way you communicated with your squad is unacceptable. You will be receiving extra duties for the next week until you can act professional again.","SSG Burch, if I catch you speaking like this again to another member of this platoon, I will recommend you for dismissal."
"You will be fine SSG Burch. These things happen, lets talk about what we can do to help you out.","SSG Burch, people argue and I am sure you and your wife will get through these tough times. ",How about we get you an extra day or two off this week to go relax?,"I will help you blow off some steam, lets get a few of your best guys to go to the shooting range this weekend and grab a few beers after.","I understand you are having issues with your wife and I am sure it will blow over, but you cannot take your frustrations out on your squad.","You are a leader to your squad, when they see you break down they will break down. If you show them anger they will show it in return, it will then become a never ending cycle.",Stop being an intolerable leader and taking your frustration out on your squad members.,I am recommending you go see a counselor for anger management. You need to get yourself together.
SSG Burch I would like it if you took the next two days off to help relax you and to solve any problems you have that were not able to be fixed due to work.,"SSG Burch things like this happen all the time, i have arguments with my wife but i always try to keep my cool and just talk it out. Take the rest of the day off to relax and be stress free.","I understand all this stress can get to people, you are doing a fantastic job and are one of the best squad leaders, just find your cool and handle the troops like you always do.","SSG Burch, you are a great squad leader and being able to handle stress is what you do best. Find some time to talk to those around you and you'll succeed and probably get promoted.",Having stress is apart of this job and not letting it out on others is what true leaders do. The fact you cannot shows me you might not be a true leader.,"You have handled stress before, correct? This little incident makes me disappointed in you and your leadership skills.","Yelling at one of your soldiers in front of everyone is not correct. I've should have done the same to you so you know what that feels like, but that's not what a true leader does.",If i ever catch or hear about you verbally abusing one of your soldiers in front of the squad again you will be replaced.
"I know of a few counselors that can help you with what you are dealing with, I'll give you their info. Take the rest of the day off and set up an appointment. ","I will make sure the soldiers understand discipline is vital, we can speak to the squad together. ","SSG Burch, working while under that amount of stress is not efficient. You have a 3 day pass this weekend. Don't worry about work try to fix things at home. ",I will have your team leads finish the rest of your work today. You and I can take the rest of the day to create a plan to get your squad where you nee them to be. ,"SSG Burch, you need to stop talking to your subordinates like that. Their actions are a direct reflection of how you lead them. ",You will not leave until things are cleared up between your squad and yourself. ,"I will be speaking with the company commander about your actions today, I am sure he will consider disciplinary action. ",You are wrong. Your squad would not act like that if you were a better leader. Don't take out your frustrations on them. 
"SSG Burch, you are our one of out best PL's, let's focus on getting your family affairs remedied. I will be scheduling an appointment for you and your wife to get cousneling. The first session is mandatory.","SSG Burch, focus on your family, as your happiness is vital to this platoons readiness. Take the day off and think about how we can fix this together.","SSG Burch, although its highly unprofessional I understand your frustrations. How about you and I work together to fix the issues you are describing?","SSg Burch, I understand the difficulties of marriage, my wife and I argue as well, but we must not allow that to affect our troops as if we lose them, its likely we lose the marriage, or vice versa. Then, we lose two families.",Leave your marraige at home and take care of soldiers when you're here.,Would you like me to talk to you like that?,"Good job, keep up the good work and set those soldiers straight!",Lay into him harder next time.
"SSG Burch, I understand it's difficult to deal with troops who are constantly screwing up, but the way you're handling the situation is not the right way to go about it.","SSG Burch, let's do some yoga to help you relieve some of the stress you've been enduring lately.","SSG Burch, take some time off to resolve your personal matters. Perhaps, I can walk you down to the Chaplain. He may be able to help you deal with your family-related stress.","SSG Burch, you're a great NCO, but you shouldn't bring your personal matters to work. If you feel comfortable doing so, then let's discuss the problems you've been having at home to come up with a solution.","SSG Burch, I'm disappointed that you're treating your Soldiers the way you are. This is not like you at all.","SSG Burch, I don't know what to do with you right now. Not only are you making yourself look bad, but you're making the Platoon look bad.","SSG Burch, you should not be taking your problems out on your squad. If I hear that you are continuing to do so, then I will have you kicked out of the army.","SSG Burch, you need to leave the issues you're having with your family at home. You need to apologize to Jones and go somewhere for a while to cool off."
"Listen, calm down. I am sorry about what is happening at home but that does not mean that you can take this out on your soldiers. Everything will be ok when it comes to your family and your soldiers' weapon. ",I promise everything will be ok when it comes to the home front. It is not your soldiers fault that your personal life is not going according to plan but they cannot suffer for that. Please try not to take your anger out on them.,"Hey SSG, everything is going to be ok. Forget about the weapon and the soldiers for a minute. Since you like Happy Hour so much, let me buy you a couple rounds and we can talk about it.","It is ok about the weapon. Do not worry about that. I am sure that your soldiers know that you are a great leader. We should all go out together for some beers and have some team building time.
","Listen SSG, I understand that you are upset about the weapon but your soldiers don't like or respect you so get used to the fact that they will never listen to you or do what you tell them to.","SSG, that sucks that you and your wife argue alot but that is what marriage is and that will not change. The arguments will only get worse and you will have many more nights of sleeping on the couch.","How dare you speak to your soldiers that way. It is not their fault that they didn't clean their weapons, it is your fault. Because it is your fault, you are going to get into a lot of trouble and I am going to dock your pay.",You and your wife argue because you are a shitty person. That is the same reason your soldiers do not listen to you. I am going to dock your pay until you decide to improve your situation.
"SSG Burch, you have a lot on your plate right now. Take the rest of the day off to go home, relax, and try to sort some things out. ","SSG Burch, your performance is critical to the success of the company; I need you calm down and be the leader I know you can be for your men. ","I will work to get you some time off in order to get you back into the right state of mind, you are a critical component to the success of this platoon.","You have the hardest working men in the entire company, try not to let your personal life spill into your professional life an maintain that high standard you have already set.",I understand you are under a lot of stress but if you continue to treat you men this way I will have no choice but to give you a negative counseling statement. I won't tolerate undue verbal harassment. ,"I'm sorry about your personal problems SSG Burch, but right now I need you to go home for the rest of the day so that you don't continue to lower the readiness of the platoon with your bad attitude. ","That soldier isn't retarded, you are for thinking you can speak to someone that way. ","If I ever hear you speak to one of your soldiers that way again I will not hesitate to chew you out in front of the entire formation, do I make myself clear?"
"SSG Burch, I understand you have many family issues right now. However, please work on the way you discipline the soldiers. ","SSG Burch, I understand what has been going on between you and your wife. However, there are professional and unprofessional ways to discipline soldiers.","SSG Burch, I know you are having family problems right now, I understand. I am here if you need someone to talk to . Please continue to discipline the soldiers, but in a professional way. ","SSG Burch, I see you are a hardworking NCO. I understand you are having family issues at the moment. Please try and leave family matters at home. You are someone the soldiers look up to. I need you to be professional and a roll model for the soldiers.","SSG Burch, I can see clearly there are some issues with your family life. However, you cannot insult your soldiers. Making your soldiers feel worthless does nothing to better this platoon.","SSG Burch, I can see you are a hardworking NCO. However, you clearly need to work on your professionalism, and how to treat your soldiers. ","SSG Burch, you need to be more professional. How you are talking to your soldiers is uncalled for. We are here to teach these soldiers, not make them feel worthless.","SSG Burch, leave your family problems at home. I do not care about what is going on in your home life. We are here to do a duty and nothing more. "
"what do you need from me SSG to help you decompress, the guys are doing there best and trying to get the job done. i need you at 100% as well, and this is not 100% talk to me about how we can help you.","Take a couple of days off and go home and figure out things at the house, when you get back we will brief each other on how things went and go on from there.","SSGT, ive got your back completely but i cant have you chewing out the soldiers on such tirades like that, hell we all like to blast the guys for being crap but our job is to build them up. ",Lets go grab some lunch and talk about whats causing all these problems.,"I could care less about whats going on in your family life SSGT, this is a professional environment and what i just heard was not even the least bit of professional and i wont tolerate that at all.. MY OFFICE NOW.","SSGT, your behavior lately has been reckless and absolutely unacceptable. I will be recommending to the commander your transfer from my platoon.","YOU SUCK SSGT, your performance is miserable and you barely come to work functioning. I have no idea how you have stayed in the army this long but I intend to change that COMPLETELY.",I think you should just leave work for today... be in my office at 0700 in the morning in your dress uniform. You have done it now.
"SSG Burch, you are receiving a counseling stamen for the past incident.","SSG Burch, i was nor aware or your situation, this is not an excuse but i believe you need some days with the family to settle things at home. ","SSG Burch, if we can focus that energy more in showing soldiers how get the job done we should get better outcomes. ","SSG Burch, your issues at home are clearly affecting your performance, i believe you need to solve home issues first ans then take care of your soldiers. ","SSG Burch, lest take a walk and talk about what is affecting your family.","SSG Burch, i know you are frustrated but we have to act as a professional that we are.  ","SSG Burch, you should never threat a soldier that way. ","SSG Burch, you should control your emotions and leave your problems at home. "
"SSG Burch, we will settle  these issues internally as a PLT. ","SSG Burch, I will make sure to address your concerns today. ","SSG Burch, you're work has been outstanding lately. ","SSG Burch, I am confident you will be promoted shortly. ","SSG Burch, you're behavior is unacceptable. ","SSG Burch, your work ethic is severely lacking. ","SSG Burch, you will be receiving an Article 15. ","SSG Burch, who the hell do you think you are speaking to a superior like that?"
I am going to give you some time off so that you can handle all of your outside business.,I understand you have been going through a hard time. If you need anything let me know.,You have been doing an excellent job with your squad. Do not let outside problems effect the great work you have been doing.,The squad really appreciates your hard work and dedication to them. You are one of my best NCOs.,"I know you have been having a hard time, but that is no way to treat a subordinate. ",I know you are really stressed out but you need to be more professional when you are at work. This performance cannot continue.,"I do not care if you are stressed out, you need to be professional at all times. If this continues I will have to pursue disciplinary action.
",If I catch you speaking to a soldier like that again I will have to counsel you and recommend further disciplinary action.
"SSG Burch, try to take some time to focus on your family so that you do not bring those problems into the work place.","I understand, hopefully you will be able to work out those problems with the wife soon.","SSG Burch, I get it. Family is more important than anything. Take an extra day off this week and try to take your wife to a nice dinner and work out some issues.","Sometimes I have issues at home too, so I understand.  If you would like to grab a drink after work with our wives and discuss time management, I think it would be beneficial.
","SSG Burch, there is a time and a place to be concerned with your family but it is not fair to unleash that anger on your soldiers.","I understand, but please do not bring your stresses of home to work.","I do not care about your problems at home, that is not my concern. My concern is the welfare of MY soldiers.","I did not ask for excuses SSG, I do not want to see that happening again."
Everyone has issues. I am here if you need anything. Just don't go so hard on the squad.,Its okay. Things will get better.,You're a great worker and we are proud to have you. Everything will work out. However you shouldn't take it out on the squad.,Good work!,That's not the way to deal with the squad. Tone it down.,Don't let me catch that again.,Next time I hear that you will be handled accordingly. ,Leave your issues at home. Work is work.
Look son things will get better they always do just try not to take it out on the soldiers.,Do not worry about it everyone has issues at home it is not your fault son. Life is hard but it will get better I promise.,"Son that sounds pretty rough how about you take the rest of the day off. Go home and be with your wife, take her out tonight on your company card.",That sounds hard son how about you and me go grab something to drink tonight and talk more about it.,Look son just do not bring your home issues to work. Nobody here cares about your issues at home.,No excuses this is work either do it right or get out. I do not want to hear you talk that way to another soldier from now on. you got that?,Well maybe you would not have so many issues at home if you were a better husband. now get out of my office.,If you were not a drunken idiot you marriage would be better. I mean how did you talk that girl into marrying an retard in the first place?
Verbal abuse is wrong and I can have you excused for that. . . but I will recommend you to counseling instead. ,I'd like you to return to your family for a few days and focus on them. When you get back I hope to see a new leadership pattern within you.,I won't be firing you! I believe you can handle this situation in the best way. You are smart. Go home and spend some paid time off with your family.,I won't report it this time. I want you to go out there and apologize. I will be popping in once in a while to see if you have made any improvements with  your troops. Don't let family issues impact your work or else more things will be affected. ,"I am sorry this behavior is not tolerated and I will have to report it. However,  I do believe you can change and/or fix this situation so I will pull for you if you start making changes.","Sorry, this conduct was wrong and I will have to place some penalties on you, but I will not be kicking you out today, but I better see some changes.",You're fired!,You're behavior was wrong and it will be reported today. I want you to go out there and apologize. You will be working overtime for the next few nights.
,,,,"Sergeant, you need to get over yourself and get your crap straight!","Sergeant, frankly I don't care what is going on at home! You need to separate your personal and professional lives and stop taking your anger out on your platoon!","I sympathize with you, Private. Do you want to talk about what has been going on?",Would you like me to refer you to a counselor? You are a good soldier and I don't want to see anything bad happen to you.
I understand the stress your receiving from home can weigh heavily on your mind throughout the day and can also impact the way your interact with your colleagues. ,Your ability to handle the stress you encounter at home and at work has shown me your dedication to your service here ,Despite the emotional strain you have been enduring at home I am pleased to tell you how well you've balanced home life and your work load,I am aware of the circumstances you have been dealing with at home and I wanted to let you know that your home life has a significant impact on your emotional health. I hope your situation improves soon,The issues you're going through at home are only going to get worse so suck it up ,Its not my fault you and your wife made the poor decision to get married without truly understanding one another so please keep your emotional baggage to yourself ,Maybe if you knew how to handle your emotions like an adult neither your home life nor your interactions with colleagues would illicit poor responses ,its your own fault that your life sucks and your failure to become more self aware 
,,,,,,,
You seem like you’re going through a hard time. I’m here to listen. ,I’m sorry your home life isn’t the best right now - you’re welcome to stay in my guest room if need be. ,Your home life doesn’t sound great right now. I’ll give you a four day weekend so you have time to work things out!,That’s a bummer. Let’s go to Disney together next weekend so you can get away for a while! I’ll buy tickets. ,your home life sounds so sad and depressing. ,"I wish I had a wife to argue with, mine died. ","Nobody cares about your home life, grow up and be professional. ","If you want to use the “r-word,” you must not want to be a leader. You’re suspended indefinitely. "
,,,,,,,
I am very sorry to hear about your troubles at home.,Reamin calm. You and your wife will work out your differences. ,Thank you for doing such a good job handling that soldier. ,You are doing great at your job. Thank you!,"I am sorry to hear about your problems at home. However, it isn't fair to take out your anger on a soldier.  ",That soldier did not deserve your anger.  it is not his fault.  ,You were being way too mean to that soldier and i feel no sympathy for you!,No excuse justifies your horrible treatment of that solider.  You are fired!
"Listen i understand you have been in stressed mood recently, why dont you take the rest of the day off and spend some time with your family. I will look after your soldiers. ",I hear you SSG Burch. How about you go get some food in the dining hall and take a break for a while. I will look after you soldiers until you come back. ,SSG I see your frustration. I will talk to your men about respect and proper protocol. You can have the day off. ,I will talk to the soldier and he will be reprimanded for the disrespect. You can continue with your day. ,The way you talked to that officer is unacceptable SSG. I understand you are under stress but how would you like it if someone talked to you this way. ,"SSG i understand you stressed but you can not talk to the soldier that way. What if someone talked to your kids like that, wouldn't you be upset? ","SSG the way you spoke to that soldier is unacceptable. It seems that he isnt the retarded one here, you are. ",SSG if i ever catch you speaking to another man like that again the couch will be the least of your worries. This abuse is probably why you are having issues with your wife.
,,,,,,,
"SSG Burch, calm down, everything will turn out alright. Try not to take it out on your men so much.",SSG Burch things may be hard but you need to work it out with your wife. Take a few days off and spend some quality time with her.,"SSG Burch everything is cool, no worries. Take it easy. Don't take it to your men.",It's alight. Don't forget what you are here for though.,Calm down don't get so worked up. You need to apologize to your men for your behavior though.,"SSG Burch, it's no problem, you'll work it out. Start by being more considerate of your men's feeling though.",None of that matters. Get out of here and treat your men with respect!,"I don't want your excuses, just don't being your personal problems to work with you."
,,,,,,,
,,,,,,,
"SSG Burch, come into my office. Hey you need to come down man before you have a stroke over something that does not require all that stress you are putting on yourself here and at home. I need you to take it easy. Let your team leaders talk to the squad.",SSG Burch lets go into my office so we can discuss how you can take a whole different approach to your Soldiers without stressing you and the Soldiers out. I understand time with the Soldiers can be tough on us. ,"SSG Burch I understand that you have a lot going on at home, You are one of my better NCOs. I need you to be professional at all times at work and at home. I'm going to seek you some counseling, to help you at home and work.",SSG Burch what is going on with you and that Soldier. I understand some Soldiers is just not going to get it right. I don't know why some of them join the military. Don't stress yourself out over their ignorance.,"SSG Burch, i understand that you have a lot on your plate here at work and home. You are good NCO, but you cannot keep calling Soldiers dumb idiots. I need you to be professional at all times. Conduct yourself as an NCO.",SSG Burch why are yelling at a Soldier about a dirty weapon. You have a lot going on at home already and it seem like you are bringing it to work. We don't need you abusing Soldier by calling them names.,"SSG Burch, i don't care what is going on at your home. You will not come to this environment and belittle any Soldier, do i make myself clear.",SSG Burch your behavior is unacceptable and it will not be tolerated here at work. I will not let you verbal abuse Soldiers and disrespect them by snatching any items out of there hands. Do i make myself clear.
