"Region 4(High Valence, Low Intensity)",,"Region 1 (High Valence, High Intensity)",,"Region 3( Low Valence, Low Intensity)",,"Region 2 (Low Valence, High Intensity)",
"We need to keep home and work separate the best we can. There is a reason why your the squad leader and they answer to you. And, the answer has a lot to do with experience and professionalism. Just try to keep that in mind. ",I'll help with overseeing maintenance. Take a few moments and lets think though this. ,"That was not the right way to go about it. But hey, your right to upset. What Can I do to help?",Just know you have my full support. Probably should not have called him that but I'll take the heat for it. Try to call him something a little more socially acceptable. ,It sounds like a hard time. It will probably always be hard and you could always just leave the Army. ,What to also start worrying about job? I can make that happen. ,Keep it up and your ass is gone.,Your no better than the person you train. 
"I understand what you are going through, family life in the military can be difficult. You are a trusted SL, so I know you will get through this. ","Let's just relax and take the rest of the day off. Blow off some steam, maybe get some flowers for your wife and put in that quality time. ",How about you and I go get a drink? Your squad and my platoon have their orders for the day so let's go have a cold one. ,"Man, was that a talking to? That thing about retarded kids made me crack up! Keep that up and he'll be licking his weapon clean. ","SSG, pull yourself together. This is pathetic, if you can't handle your issues at home, don't bring them to the office. ","Stop complaining about your family problems, you don't think we all have shit going on? Be a man for God's sake.  ","Well, SSG your men are a direct reflection of your leadership so these screw ups are on you as far as I am concerned. ","You know who needs a talking to is you, get yourself and your men in line. I don't want your excuses. "
"It's okay to have those feelings, but don't take it out on the soldiers. If you need some time off to sort out your personal life, take it.  ","If you come to work with frustrations, try not to show it to the soldiers. Feel free to come into my office and talk anytime you need to vent or get negative feelings out of your system.","You should take some time off and relax. You work hard, and I'm thankful for it.",,,,Your wife probably makes you sleep on the couch because of your horrible attitude.,
"SSG Burch, I completely understand what you're saying. My wife and I go through phases like this too, where we argue about everything. It will definitely pass. I wouldn't be so hard on Jones or your other guys though. ",I can tell you've been going through a lot lately. Why don't you take the rest of the day off to fix some things at home and I'll make sure your guys are squared away. ,"I can tell you're very stressed about stuff at home, why don't you take the afternoon off to smooth things over and then when you get back tomorrow, you and your guys can rally after pt. ","SSG Burch, you're one of the best trainers here, don't focus too much on coming down hard on your guys. You've trained them to do the right things. Keep pushing them forward and setting the standard",It's been a long week for you SSG Burch. I expect you to take things like that in stride. I am disappointed with how you handled yourself back there. ,"I'm going to send you home for the afternoon SSG Burch. Not because you deserve it, but because your guys deserve more out of you. Come back tomorrow ready to be the best. ",You think you're angry at your guys? How do you think I feel? I have to reprimand a SSG who is supposed to be in charge and setting the standard!,"I don't care what's going on at home, you are a professional. I am very angry about how you're treating your guys and I am going to counsel you for this behavior. "
"SSG Burch, I understand you are having some difficult times,why don't you take the rest of the day off to relax.","Go ahead and take a few minutes to recover, I understand the stress you are currently undergoing. I'm sue everything will pass soon. ",I admire your commitment to detail. You are one of the finest NCO's this company and I expect great things from you in the future. We just need to work on your approach to your subordinates.,"I appreciate all that you do for this company, and that individual should be reprimanded or failing to keep proper weapon maintenance. Take the day, go home and get some R & R.","Regardless of the situations you are currently having at home, that is no excuse to act in the manner that you did.",I'm afraid that that kind of behavior is unbecoming of an NCO. I need you to take a minute to reconsider your actions.,The actions of your soldiers are a direct reflection of you and if their weapons are not maintained properly it is because you have failed them.,There are no circumstances in which an NCO should be acting this way. I'm afraid I'm going to have to reprimand you.
 I know your are great man but why do not you take a break just to let the steam off.,Please tell me about your problem I might be able to help you.,I want to give you a 2 days leave so you can relax and bring yourself back to senses.,"You have been working very hard, I think you deserve a a few days off with your family.","I know your upset but that is not a way to talk to your subordinates like this, I am disappointed.","You are not supposed to humiliate your own soldiers, you are failing me.",You either get you stuff together or you will be out in no time,"No one is going to help you, you are on your own"
"SSG Burchh, it seems as though you need some time off to clear your head or relieve some of the stress that you're undergoing. Why don't you take the rest of the day off and come back tomorrow so that we can talk about how you're doing then. ","I'm sorry to hear about problems at home. Take the rest of the day off, talk to the wife, come back tomorrow with a clearer head. ",Let me talk to your squad and see if we can work on better ways to getting the job done. ,"If you're ever having too much of a stressful day and need someone to talk to, don't hesitate to talk to me about any problems you have. ","SSG Burch, regardless of the problems you have at home, you cannot be treating your soldiers in a condescending manner. ","I don't care what your problems at home are, you cannot treat your soldiers this way. ","You will not be treating your soldiers this way again. If I see this again, I will give you a written counseling.","This is your first and last warning, if I see you treating your soldiers this way again, I will have no other choice but to try and find someone else to take your place a squad leader."
"SGT, these men and women look up to you, they deserve your best. Let's see about getting you some time off to handle these issues at home before they handle you. ","SGT, let's take a moment to separate the issues you have going on. You're one of the best here, let's see what we can do to get all this sorted. ","SGT, you know much better than I that you don't bring your problems from home into the workplace. ","Look here, we don't have time for any of that right now. Let's you and I find some time to get a beer later and talk, but right now I need you back outside working with these guys and getting them right. ","So, you're telling me that you've got problems at home that you're not only bringing here to work, but taking out on your troopers? Why are you in a leadership position right now? ",Aren't you the one always talking about accountability for one's actions? What are you doing right now? ,"You better bottle this BS up right now and get back outside. This isn't acceptable anywhere, let alone in this unit. ","I don't even know why I bothered to pull you aside to talk about this, you already know what you're doing wrong. Get back out there. "
Maybe you could relax a bit and try to make work a place to get away from issues you are having at home. ,"We all have rough patches, why don't we focus on getting the platoon in order using a nicer approach so at least your responsibilities here won't be as stressful?",I understand you're having a bad time but lets get back out there and straighten out the platoon with a better attitude this time.,I'll watch over the platoon for now while you can take a few of the more motivated and experienced individuals to complete some different task.,"Well I know a good divorce lawyer, sounds like you have your work cut out for you.",Maybe you have a big life change and need to be thinking about that to focus more on what is going on here.,Sounds like your wife and the platoon have the right idea about you.,"If you organized your life better you would be able to organize your work too, I suggest you get to it."
"I understand, we all have had some sort of issues outside of work. I know its easier said than done, but you have to wear multiple hats. You cannot take your frustration out on your soldiers when they had nothing to do with it. ","Try to take deep breath and relax. Take off, go to the gym, blow some steam off and come back and re group. ","I understand what you're going through, but you cannot talk to your soldiers that way. Hard times don't last forever. You and your family will get through this. How about I have something at my house tonight and you and your wife join my family?",I'm going to apologize on your behalf and take over for the rest of the day. You go home and spend some time with your family. ,"If you keep acting like this, I will not always be able to save you. ","The way you are acting is not okay, something is going to have to change asap or things at work and home will only get worst. ",Have you ever thought that it might just be time for a divorce? ,You need to figure out a better way to communicate with you soldiers or you're going to be in for a rude awakening very soon and I will not save you.
"I understand your frustration. Going through family issues is difficult. If you need any help, let me know.","If you want to, I can give you some time off to go see a family therapist, so that you and your wife can get on the same page.",Take the tomorrow off to spend with your wife and kids. This job can be very stressful and I don't want it to affect your relationships at home.,"If you are having problems at home, it would be good for me to know. Let's go out for lunch today and you can tell me what is going on and how I can help.","Family trouble isn't easy, but you cannot take it out on your soldiers. Don't pass on your troubles to your subordinates or you will destroy their morale.","Trouble with your wife is a challenge, but you need to sort out your struggles at home and separate your home problems from your work problems.",That is unacceptable the way you treated your soldier. You cannot take out your frustrations on them. You will have extra staff duty this weekend.,You need to apologize to your soldier. That is not appropriate language nor technique to teach your soldiers. Next time that happens you will be punished more severley for your actions.
I am here to listen to you any time you need to talk. Remember to not take your personal issues out on your subordinates.,I am sorry your going through so much. Just remember to keep your cool in front of your subordinates. ,"I am here for you anytime. We all go through hard times. I know you care about your subordinates, you just have to take a deep breath and address them accordingly.",Just remember you have people in your corner if you need them. Try your best to treat your subordinates with respect. ,"I hear what you are saying. However, the way your treated your subordinate is unacceptable.",I understand you are going through a lot but you need to keep your cool and treat your subordinates better. I will be giving you a counseling today.,I don't know who you are or why you think its okay to treat your subordinates in such a manner. If I hear of you treating your subordinates like this again I will recommend an article 15.,Why the fuck would you think it is okay to treat your subordinates in such a manner. You were verbally abusive and made yourself look terrible. Get your act together.
I understand you are going through a hard time and that it's challenging to keep work and home separate. I'm sure you'll react better next time.,"That must be very challenging for you. In the future, let me know if you need anything to help with your training and your soldiers. Maybe that can make you less stressed out.",That sounds frustrating! Why don't you take the night off to try and make peace with your spouse? ,You'll be more focused if you can take care of the issues at home. You can go home early and take your wife out to make things better,"You know better than to exhibit that kind of behavior. You are going through something difficult, but so are each of your soldiers. Be a better example.",You're not living up to the values you promised to uphold. You know what you're doing is not right. Let me know by tonight how you plan to make things better here at work.,What on earth are you doing? What makes you think you can behave in such an unprofessional manner? Abuse of your soldiers will not be tolerated. You will be couseled,You cannot take out your personal feelings on your soldiers. You are interfering with their training. You get extra duty this weekend.
Calm the SGT down we reassurance that the arguments will die down. Ask if he wants to discuss different ways to overcome the distress,Hey SGT things been rough on you today. Take the rest of the day off and work through some things but tomorrow come back ready to work. ,Focus on how the arguments are happening because each party cares. Say you would gladly help mediate discussions if that would help them out,Give the SGT a date activity and day off to take his wife out to help reduce the stress build up,Tell the SGT he needs to get his shit together before the mood affects everyone around him and that work and home life cant be mixed,Berate the sgt for allowing his emotions to get in the way of his work,Get SGT going about one of the arguments to remind him of why he was energetic and upset,Tell SGT that maybe your wife is right however it dont matter now we at a work environment and need you focused 
"SSG, all relationships encounter ups and downs. If you and your wife continue to use open communication this period won't last.","SSG, fighting with our spouses is normal. I would suggest taking a few days of leave to spend doing something both you and your wife love to do. Stress-relief.","SSG, stop focusing on the negatives. You have a beautiful family to share your life with. Why don't you take the weekend and go out and do something fun?",,The military is a stressful lifestyle. I've seen a lot of failed marriages.,Sometimes things just don't work out.,Your wife should be more understanding.,Your wife is ungrateful.
I will arrange for you to take a week off to gather yourself and recuperate. Maybe arrange some spousal therapy. ,Go ahead and take a pass for a few days to mentally recuperate.,You can go ahead and leave early today. Take a bit of time off and relax.,I'll arrange for you to take some time off. Recharge and fix any at-home problems you might have; then its back to work.,"When you take your anger derived from your personal problems out on your subordinates; whom are undeserving of that kind of treatment, do you know how much sympathy for you that generates in me? None.",You need to go ahead and leave early today. Cool off an then come back tomorrow. I can give you time to deal with home problems but you will not take your anger out on your subordinates.,You home situation belongs to you. Your men have done nothing to deserve the verbal abuse you give them just because you and your wife had some arguments; now go away. ,I don't know about whats going on between you an your household; all I know is that there will be severe repercussions if you speak to one of your subordinates that way again. Am I clear?
SSG Burch you are just going through personal issues right now and its affecting work. Let me help you solve them.,"SSG Burch you are a good NCO, I am here to help, don't let your frustrations affect work.","SSG Burch you are the best NCO here, ill give you time to sort through your personal issues",SSG Burch there many Army resources to help you with your situation. I'll give you time off to fix them.,SSG Burch I expected better from my NCOs. Fix your personal issues.,SSG Burch I'll have to relieve if you keep this bad behavior up.,This confirms how terrible of an NCO you are. I am taking action to replace you.,This isn't the first time this has happened. You fail to lead your soldiers.
"SSG Burch, you are definitely working so hard for this platoon. I believe that you are one of the best I have here. Hope you can see that I am counting on you.","SSG Burch, just forget about his mistake. We all make mistakes when we are inexperienced! You are a good soldier and I always see it. Please relax and let's focus on making our platoon better!","SSG Burch, you are the best man I have. I am trying to send a recommendation to the chain of command for you to have a waiver for a promotion due to your hard work. Please do not let it slip with showing your anger. ","SSG Burch, I believe that you are doing such a hard work and I am going to try my best to make you recognized to the higher level. Cheer up and keep your good work! Do not stress out and let's be professional all the time.","SSG Burch, who the fuck do you think you are? Do your fucking work right and stop putting blame on others!","SSG Burch, just shut the fuck up and do not create any problem in my platoon. Otherwise I will do my best to get you punished.","SSG Burch, you think you are doing right right now? If yes, keep doing it. I can't see any difference from you and him at this point anyway.","SSG Burch, if you can't control yourself with your emotions, you have no right to lead your troop. I want to see you behaviour better next time or it will be you to be yelled at."
"I understand where you're coming from, family problems are tough. Have you thought about seeing a counselor? ","Problems with the wife are the worst, I've been in the doghouse a few times myself. Have you tried hashing out the problems with her calmly?",,,"I know family issues are hard, I have a wife myself, but it is extremely unprofessional to bring those problems to work with you.","I understand the stress you are going through, but taking your problems out on the soldiers like that is damaging to morale.",You are acting extremely unprofessional and you need to keep your home issues AT HOME. Do I make myself clear.,"This is unacceptable behavior from a leader, you need to learn to control yourself. I don't care whats going on at home, that shouldn't affect your work."
"Do not talk down to any soldier,like that again. Next time it will a negative counseled on you.",Carry on soldier.,Good way of maintain disciple. ,Carry on soldier.,"Stop picking on your soldier, and be professional.",Go fix your personal issues.,Take the day off.,Stop harassing your soldiers.
I understand your frustration. Take the day off and we'll talk about it again tomorrow,"Lets talk about how we're going to solve this problem and not focus on the negative. It just needs a methodical approach, we'll fix things in no time.",Don't worry about it. It happens to all of us. Let's just try to take a step back next time and understand why we're really going off. ,"Everything is going well for you right now, try to let the small things roll off your shoulder. You've been doing great things with your soldiers.",It's unacceptable behavior and if I see it again you will be counseled.,You have failed your soldiers by letting outside issues cloud your judgment.,"Tell me right now, how in the hell does your home issues justify your yelling at a soldier at work. They count on you",You are a complete fuck up and you just won't stop fucking up. How would you like the same treatment?
"How about you take some time off to be with you're wife, no questions asked?",I'm sure some time away from the job will help you too. take some time and come back with a clean slate.,Remember to keep work and family separate. Ill help you out but lets go motivate our troops into doing the right thing!,"Im sure you just need to decompress, take the day off and come back tomorrow fresh",Dont take your own frustrations out on my soliders. That's terrible leadership and teaches bad habits.,Maybe if you werent so disagreeable your soldiers would be better.,If you dont get back there and make sure every single rifle is clean i'm gonna gonna write up a counseling for you.,You're doing everything wrong with your soldiers and youre family. ill show you how its done
"SSG, we will find a way to help you and your family overcome this difficult situation. The family center or the chaplain provide marriage counseling. ",This can happen to all of us. Let us focus on finding a solution to your situation. ,"SSG, I will give you some time off, so you can focus on resolving your family issues. ",,You failed at your job.,You need to learn how to separate job from your private life. ,"I will counsel you for your behavior. Yelling at your subordinates in such a manner is unacceptable!
",How about you being the idiot here for not having your troops under control!
"SSG Burch, take the rest of the day off to cool down and we'll address this tomorrow.","It seems like you need some time off to sort things out, possibly go see Army family resources. Head home for as long as you need.","SSG Burch, you're one of the best soldiers we have. Your work is impeccable and it just seems like you need to take a break. Your off for the rest of the day.",I would hate to see one of my best soldier's go down a bad path. Let me know if there's anything I can do to help you.,"SSG Burch, I know you're a better person that what you just described. Soldier on and get a handle on your own issues.","SSG Burch, you're a good soldier but I can't believe you're letting your personal life effect your work life. I expected more professionalism from you.",How dare you bring your family frustrations to work and take it out on my soldiers. Get a handle on yourself SSG.,What I just witnessed was a complete lack of professionalism expected of a NCO. Do not let me catch you doing something like that again.
"I understand Sergeant. Tell you what, have a Team Leader take over for the rest of the day and take the day off to relax.",Have your Squad clean weapons and in the meantime take an hour or so to cool off.,I'm sure things will work out. How about we get your Squad and get some pt in at the gym?,I understand that. Your one of my best Squad Leaders lets get some work done and we'll talk at the end of the day and work on a solution.,"Take a minute to cool down, but you need to go back out there and lead that Squad. You can't just take off because you're having a bad day.","There's a Squad out there waiting on you, take a second to get yourself together and lets keep going.","Sergeant, everyone has personal problems, that is no reason to take it out on one of your Soldiers. I expect better discipline from my Squad Leaders.",Get yourself together and lead your Squad. You need to work on your personal life on your personal time.
,,,,,,,
SSG Burch why dont we just take a walk and you can cool off? i understand your frustration.,Dont worry about that guy. make your team leader deal with the situation.,Thats how you do it. i love the intensity and passion you use for the privates.,im proud of the energy you put into this job. Smoke him later SSG Burch.,What are you doing? you are the idiot if you are speaking to your men like that. so unprofessional.,"SSG, while i understand your situation, please refrain from taking it out on soliders who have nothing to do with your personal life.","you are stupid, thats not going to help the soldiers out in the long run!",how about i snatch your stuff and call you a retard? if i hear you say it again i will take care of this later in my office.
"Everyone suffers with family issues, but it is vital to keep your personal life separate from your work life. Maybe you should try some counseling. ","There will always be stress at work and at home, but you need to balance it out. Try to keep a positive attitude and if you need anything I am here.",There is always marriage counseling. It works and can help resolve the issues at home. Do not give up and keep pushing. You are an outstanding SSG whose family and country needs you.,Your work ethic is great and you have a beautiful family to come home too. Many of us do not have anyone. Stay at a friends house after you drink to avoid confrontations. Your squad is intelligent because you've trained them so well. Stay positive. ,Your wife is innocent and has nothing to do with your problems. Same goes for your squad. Its all on you and your choices.,"SSG, while i understand your situation, please refrain from taking it out on soldiers who have nothing to do with your personal life. ",It's your fault that this is happening. Maybe you should drink less or not at all. Your wife is innocent. She is not to blame.,You should never yell at someone in your squad like that. Who do you think you are? I'm going to give you a counseling statement.
